{
  "knowledge_manifest_version": "1.1",
  "corpus_id": "device_partition_fixture",
  "description": "Test-only corpus proving shared knowledge plus device-scoped partitions.",
  "retrieved_at": "2026-08-21T02:00:00Z",
  "chunk_max_characters": 512,
  "documents": [
    {
      "source_id": "pyaedt_shared_api_fixture",
      "url": "../../tests/fixtures/pyaedt_api_minimal.html",
      "source_type": "local_fixture",
      "content_format": "html",
      "product": "PyAEDT",
      "product_version": "2025.2-contract-fixture",
      "license": "repository test fixture",
      "knowledge_type": "test_fixture",
      "device_classes": ["shared"],
      "topics": ["setup", "sweep", "touchstone_export"],
      "language": "en",
      "authority": "test_fixture",
      "validation_status": "test_only"
    },
    {
      "source_id": "antenna_workflow_fixture",
      "url": "../../tests/fixtures/knowledge_antenna_workflow.html",
      "source_type": "local_fixture",
      "content_format": "html",
      "product": "HFSS",
      "product_version": "test-fixture",
      "license": "repository test fixture",
      "knowledge_type": "test_fixture",
      "device_classes": ["antenna"],
      "topics": ["geometry", "excitation", "sweep"],
      "language": "en",
      "authority": "test_fixture",
      "validation_status": "test_only"
    },
    {
      "source_id": "rf_filter_workflow_fixture",
      "url": "../../tests/fixtures/knowledge_rf_filter_workflow.html",
      "source_type": "local_fixture",
      "content_format": "html",
      "product": "HFSS",
      "product_version": "test-fixture",
      "license": "repository test fixture",
      "knowledge_type": "test_fixture",
      "device_classes": ["rf_filter"],
      "topics": ["ports", "passband", "touchstone_export"],
      "language": "en",
      "authority": "test_fixture",
      "validation_status": "test_only"
    },
    {
      "source_id": "inductor_workflow_fixture",
      "url": "../../tests/fixtures/knowledge_inductor_workflow.html",
      "source_type": "local_fixture",
      "content_format": "html",
      "product": "HFSS",
      "product_version": "test-fixture",
      "license": "repository test fixture",
      "knowledge_type": "test_fixture",
      "device_classes": ["inductor"],
      "topics": ["s_parameter", "inductance", "quality_factor"],
      "language": "en",
      "authority": "test_fixture",
      "validation_status": "test_only"
    }
  ]
}
